{
  "schema_version": 1,
  "policy_version": 1,
  "blueprint_ref": "V1.1 section 13",
  "allowed_request_types": [
    "SignOrder",
    "SignCancelByCloid",
    "SignCancelByOid",
    "SignScheduleCancel"
  ],
  "denied_actions": [
    "withdraw3",
    "usdSend",
    "spotSend",
    "sendAsset",
    "agentSendAsset",
    "vaultTransfer",
    "subAccountTransfer",
    "approveAgent",
    "revokeAgent",
    "createVault",
    "modifyVault",
    "createSubAccount",
    "modifySubAccount",
    "cDeposit",
    "cWithdraw",
    "tokenDelegate",
    "approveBuilderFee",
    "signRawAction",
    "updateLeverage",
    "updateIsolatedMargin",
    "signUserEip712",
    "usdClassTransfer",
    "subAccountSpotTransfer",
    "perpDexClassTransfer",
    "convertToMultiSigUser",
    "claimRewards",
    "linkStakingUser",
    "spotDeploy",
    "perpDeploy",
    "setReferrer",
    "evmUserModify",
    "userDexAbstraction"
  ]
}
